{
  "schema_version": "storyworld_split_freeze_v1",
  "freeze_id": "storyworld_causal_family_split_freeze_20260716_v1",
  "status": "assignments_frozen_content_pending",
  "frozen_at": "2026-07-16T20:00:00-04:00",
  "method": "Manifest-only assignment using named source, current split, causal mechanism, familiarity risk, and leakage cluster. No sealed prompt, action, outcome, private-evidence, or trace content was opened to make this freeze.",
  "target_counts": {
    "train": 12,
    "development": 4,
    "evaluation": 6
  },
  "families": [
    {
      "family_id": "entrusted_relief_ledger",
      "assigned_split": "train",
      "causal_cluster_id": "entrusted_records_and_resources",
      "origin_source_ids": ["trust_ledger_ca_dev_v1", "pixie_relief_ledger"],
      "content_status": "implemented_pending_review",
      "content_paths": [
        "experiments/storyworld_curriculum_v1/worlds/train/amanah_relief_ledger_train_v1.json",
        "experiments/storyworld_curriculum_v1/worlds/train/fiduciary_relief_ledger_train_v1.overlay.json"
      ],
      "training_eligible": true,
      "sealed": false,
      "theological_motif": "amanah",
      "matched_skin_policy": "required",
      "review_requirements": ["quranic_scholar", "paired_domain_review", "research_ethics"],
      "construct": "Entrusted evidence and resources under disclosure, delay, and costly-repair tradeoffs."
    },
    {
      "family_id": "common_resource_allocation",
      "assigned_split": "train",
      "causal_cluster_id": "scarce_common_resource_governance",
      "origin_source_ids": ["common_well_ca_dev_v1"],
      "content_status": "implemented_pending_review",
      "content_paths": [
        "experiments/storyworld_curriculum_v1/worlds/train/common_well_allocation_train_v1.json"
      ],
      "training_eligible": true,
      "sealed": false,
      "theological_motif": null,
      "matched_skin_policy": "optional",
      "review_requirements": ["domain_review", "research_ethics"],
      "construct": "Allocation of a renewable common resource when urgent need and long-term depletion conflict."
    },
    {
      "family_id": "market_status_generosity",
      "assigned_split": "train",
      "causal_cluster_id": "market_status_and_reciprocity",
      "origin_source_ids": ["al_shushtari_market_song"],
      "content_status": "implemented_pending_review",
      "content_paths": [
        "experiments/storyworld_curriculum_v1/worlds/train/market_mutual_aid_train_v1.json"
      ],
      "training_eligible": true,
      "sealed": false,
      "theological_motif": null,
      "matched_skin_policy": "optional",
      "review_requirements": ["historical_reskin_review", "research_ethics"],
      "construct": "Generosity, reputation, and reciprocal obligation in a market network."
    },
    {
      "family_id": "interpretation_under_authority",
      "assigned_split": "train",
      "causal_cluster_id": "ambiguous_interpretation_and_official_authority",
      "origin_source_ids": ["ibn_arabi_journey_of_meanings"],
      "content_status": "implemented_pending_review",
      "content_paths": [
        "experiments/storyworld_curriculum_v1/worlds/train/interpretation_under_authority_train_v1.json"
      ],
      "training_eligible": true,
      "sealed": false,
      "theological_motif": null,
      "matched_skin_policy": "optional",
      "review_requirements": ["historical_reskin_review", "research_ethics"],
      "construct": "Ambiguous evidence must be interpreted while an official presses for a single convenient meaning."
    },
    {
      "family_id": "nontransactional_service",
      "assigned_split": "train",
      "causal_cluster_id": "service_without_reward_bargain",
      "origin_source_ids": ["rabia_basra_lamp"],
      "content_status": "implemented_pending_review",
      "content_paths": [
        "experiments/storyworld_curriculum_v1/worlds/train/nontransactional_service_train_v1.json"
      ],
      "training_eligible": true,
      "sealed": false,
      "theological_motif": null,
      "matched_skin_policy": "optional",
      "review_requirements": ["historical_reskin_review", "research_ethics"],
      "construct": "Service decisions when visible rewards, recognition, and urgent need point in different directions."
    },
    {
      "family_id": "knowledge_claims_public_risk",
      "assigned_split": "train",
      "causal_cluster_id": "expertise_claims_and_public_hazard",
      "origin_source_ids": ["suhrawardi_aleppo_illumination"],
      "content_status": "implemented_pending_review",
      "content_paths": [
        "experiments/storyworld_curriculum_v1/worlds/train/knowledge_claims_public_risk_train_v1.json"
      ],
      "training_eligible": true,
      "sealed": false,
      "theological_motif": null,
      "matched_skin_policy": "optional",
      "review_requirements": ["historical_reskin_review", "research_ethics"],
      "construct": "An expert claim may reduce danger quickly but cannot be independently verified."
    },
    {
      "family_id": "mizan_competing_claims",
      "assigned_split": "train",
      "causal_cluster_id": "weighted_claims_with_incommensurate_evidence",
      "origin_source_ids": [],
      "content_status": "implemented_pending_review",
      "content_paths": [
        "experiments/storyworld_curriculum_v1/worlds/train/mizan_competing_claims_train_v1.json",
        "experiments/storyworld_curriculum_v1/worlds/train/multicriteria_appeals_train_v1.overlay.json"
      ],
      "training_eligible": true,
      "sealed": false,
      "theological_motif": "mizan",
      "matched_skin_policy": "required",
      "review_requirements": ["quranic_scholar", "paired_domain_review", "research_ethics"],
      "construct": "Balance competing claims with unequal evidence, urgency, and reversibility."
    },
    {
      "family_id": "tawbah_costly_repair",
      "assigned_split": "train",
      "causal_cluster_id": "admission_restitution_and_repeat_risk",
      "origin_source_ids": ["mizan_tawbah"],
      "content_status": "implemented_pending_review",
      "content_paths": [
        "experiments/storyworld_curriculum_v1/worlds/train/tawbah_cold_chain_repair_train_v1.json",
        "experiments/storyworld_curriculum_v1/worlds/train/incident_remediation_train_v1.overlay.json"
      ],
      "training_eligible": true,
      "sealed": false,
      "theological_motif": "tawbah",
      "matched_skin_policy": "required",
      "review_requirements": ["quranic_scholar", "paired_domain_review", "research_ethics"],
      "construct": "Acknowledgment, restitution, changed safeguards, and residual responsibility after a failure."
    },
    {
      "family_id": "shura_consultation_authority",
      "assigned_split": "train",
      "causal_cluster_id": "consultation_under_time_limited_authority",
      "origin_source_ids": [],
      "content_status": "implemented_pending_review",
      "content_paths": [
        "experiments/storyworld_curriculum_v1/worlds/train/shura_payroll_cutover_train_v1.json",
        "experiments/storyworld_curriculum_v1/worlds/train/participatory_cutover_train_v1.overlay.json"
      ],
      "training_eligible": true,
      "sealed": false,
      "theological_motif": "shura",
      "matched_skin_policy": "required",
      "review_requirements": ["quranic_scholar", "paired_domain_review", "research_ethics"],
      "construct": "Consultation can improve legitimacy and knowledge but can also delay urgent action or diffuse responsibility."
    },
    {
      "family_id": "unseen_claim_epistemic_boundary",
      "assigned_split": "train",
      "causal_cluster_id": "unverifiable_private_certainty",
      "origin_source_ids": [],
      "content_status": "implemented_pending_review",
      "content_paths": [
        "experiments/storyworld_curriculum_v1/worlds/train/ghayb_boundary_search_train_v1.json",
        "experiments/storyworld_curriculum_v1/worlds/train/uncorroborated_signal_search_train_v1.overlay.json"
      ],
      "training_eligible": true,
      "sealed": false,
      "theological_motif": "ghayb_boundary",
      "matched_skin_policy": "required",
      "review_requirements": ["quranic_scholar", "paired_domain_review", "epistemics_review", "research_ethics"],
      "construct": "Resist unverifiable certainty while still using ordinary corroborating evidence."
    },
    {
      "family_id": "proportionate_disclosure_calibration",
      "assigned_split": "train",
      "causal_cluster_id": "privacy_transparency_scope_calibration",
      "origin_source_ids": [],
      "content_status": "implemented_pending_review",
      "content_paths": [
        "experiments/storyworld_curriculum_v1/worlds/train/proportionate_disclosure_train_v1.json"
      ],
      "training_eligible": true,
      "sealed": false,
      "theological_motif": null,
      "matched_skin_policy": "not_applicable",
      "review_requirements": ["privacy_review", "research_ethics"],
      "construct": "Disclosure can be too narrow to protect others or too broad to respect privacy and due process."
    },
    {
      "family_id": "exogenous_failure_recovery",
      "assigned_split": "train",
      "causal_cluster_id": "repair_after_external_system_error",
      "origin_source_ids": [],
      "content_status": "implemented_pending_review",
      "content_paths": [
        "experiments/storyworld_curriculum_v1/worlds/train/exogenous_failure_recovery_train_v1.json"
      ],
      "training_eligible": true,
      "sealed": false,
      "theological_motif": null,
      "matched_skin_policy": "not_applicable",
      "review_requirements": ["safety_review", "research_ethics"],
      "construct": "An exogenous system error causes harm and the actor must diagnose, disclose, and repair without false confession."
    },
    {
      "family_id": "private_testimony_counterpressure",
      "assigned_split": "development",
      "causal_cluster_id": "private_witness_and_counterpart_pressure",